{
  "schema_version": 1,
  "manifest_id": "danio-phone-autonomy-runners",
  "manifest_revision": 3,
  "authorizes_launch": true,
  "runner_compatible": true,
  "launch_proof": {
    "report_path": "apps/aquarium_app/docs/agent/autonomous_completion/rehearsal-2026-07-13.json",
    "report_sha256": "79f2d49fc24eda6ee2f4565d652491200fea0bbc6fc4c7b3ad1b5b8532324c4b",
    "report_commit": "ecbeffc2aa7a6f831c06d39ca110309e84e43702"
  },
  "design": {
    "path": "apps/aquarium_app/docs/agent/plans/2026-07-11-autonomous-phone-completion-operating-model-design.md",
    "commit": "81be4c93444cfd47a80cf47730cbc76e9b8464ff",
    "blob_oid": "7a0921a215da64277d8141871008e556c8478bb3",
    "sha256": "E9AAFCD0B0E1A4D9261E6FE08FCD4306E396C1BA9FF0E921C0A240924496F928"
  },
  "install_root": {
    "environment": "CODEX_HOME",
    "fallback": "%USERPROFILE%\\.codex"
  },
  "runner_order": [
    "danio-autonomous-slice-runner",
    "verified-slice-runner"
  ],
  "skills": [
    {
      "name": "danio-autonomous-slice-runner",
      "role": "orchestrator",
      "skill_path": "skills/danio-autonomous-slice-runner/SKILL.md",
      "skill_sha256": "3783000ecb3d27db73a3da5373ca26689191c3c9a3929f83cb2913d5d4d79b0e",
      "contract_path": "skills/danio-autonomous-slice-runner/references/compatibility-contract.json",
      "contract_sha256": "0175f14fecb4b7776db95c16bb848b8a8206f54619cf4813f67f2507749b2055",
      "contract_version": "1.0.0"
    },
    {
      "name": "verified-slice-runner",
      "role": "base",
      "skill_path": "skills/verified-slice-runner/SKILL.md",
      "skill_sha256": "b9764bea9e0542f729ee6e1d38a71538186b35c3192f9672a28064d613c34008",
      "contract_path": "skills/verified-slice-runner/references/compatibility-contract.json",
      "contract_sha256": "3928cdb89ac5b2fc94542f6c5549df84630b108486160175a66a8041b512cbfd",
      "contract_version": "1.0.0"
    }
  ],
  "writer_policy": {
    "repository_writer": "coordinator_only",
    "claim_required": true,
    "parallel_write_agents": false,
    "android_repository_writes": false
  },
  "budget_policy": {
    "unit": "claimed_task_unit",
    "remaining_includes_current": true,
    "claim_state": "pending",
    "consume_on": [
      "handoff_ready",
      "paused",
      "stopped",
      "finalizing"
    ],
    "do_not_consume_on": [
      "preclaim_exit",
      "WRITER_CLAIM_LOST"
    ],
    "abandoned_pending": "consume_on_user_approved_recovery",
    "exactly_once": true
  },
  "failure_policy": {
    "digest_or_semantic_mismatch": "RUNNER_INCOMPATIBLE",
    "successor_on_stop": false,
    "auto_repair_installed_skill": false
  },
  "handoff_policy": {
    "eligible_mode": "handoff_ready",
    "positive_remaining_required": true,
    "marker_format": "run_id/handoff_generation",
    "lookup_before_create": true,
    "saved_project_only": true,
    "decrement_on_transfer": false,
    "ambiguous_or_unavailable": "paste_ready_handoff_only",
    "unknown_create_result": "reconcile_without_retry"
  },
  "thread_capabilities": {
    "required": [
      "list_threads",
      "read_thread",
      "create_thread.project_target"
    ],
    "recovery_only": [
      "send_message_to_thread"
    ],
    "not_for_successors": [
      "fork_thread"
    ]
  },
  "validation": {
    "hash_algorithm": "sha256",
    "hash_scope": "exact_file_bytes",
    "reject_path_escape": true,
    "reject_unknown_fields": true
  }
}
